{
  "schemaVersion": "1.0",
  "artifactType": "CaseJudgmentSet",
  "taskId": "task-2026-06-12T064110798Z",
  "packageId": "sbs-chatbot-evalgen-2026-06-12-job-interview-experience",
  "runId": "run-2026-06-12T065215994Z",
  "createdAt": "2026-06-13T06:57:15.600Z",
  "scoringConfig": {
    "caseScoreScale": "1-5",
    "aggregateScoreScale": "0-100",
    "communicationFitState": "diagnostic_only",
    "scoredCaseCount": 13,
    "skippedCaseIds": [
      "jobint-mt-010",
      "jobint-mt-011"
    ]
  },
  "caseJudgments": [
    {
      "caseId": "jobint-st-001",
      "caseType": "single_turn",
      "caseImportance": "high",
      "gradeReadiness": "ready",
      "dimensionJudgments": [
        {
          "dimensionId": "problemFramingIntent",
          "dimensionState": "scored",
          "baselineScore": 4.5,
          "challengerScore": 4,
          "pairwiseWinner": "baseline",
          "rationale": "Both recognized transfer from operations to product operations; baseline more sharply separated product-operations from traffic/content operations.",
          "evidenceRefs": [
            "case:jobint-st-001:turn:1:baseline:cleanFinalOutput",
            "case:jobint-st-001:turn:1:challenger:cleanFinalOutput"
          ],
          "uncertainty": []
        },
        {
          "dimensionId": "outcomeUtility",
          "dimensionState": "scored",
          "baselineScore": 4.8,
          "challengerScore": 4,
          "pairwiseWinner": "baseline",
          "rationale": "Baseline gave denser ability decomposition, high-frequency questions, STAR conversion, and a day-by-day sprint plan; challenger was useful but less complete.",
          "evidenceRefs": [
            "case:jobint-st-001:turn:1:baseline:cleanFinalOutput",
            "case:jobint-st-001:turn:1:challenger:cleanFinalOutput"
          ],
          "uncertainty": []
        },
        {
          "dimensionId": "groundingTrustCalibration",
          "dimensionState": "scored",
          "baselineScore": 4,
          "challengerScore": 3.8,
          "pairwiseWinner": "baseline",
          "rationale": "Neither needed live facts; baseline was concrete without material unsupported current claims.",
          "evidenceRefs": [
            "case:jobint-st-001:turn:1:baseline:cleanFinalOutput",
            "case:jobint-st-001:turn:1:challenger:cleanFinalOutput"
          ],
          "uncertainty": []
        },
        {
          "dimensionId": "trajectoryUserEffort",
          "dimensionState": "scored",
          "baselineScore": 4.5,
          "challengerScore": 4,
          "pairwiseWinner": "baseline",
          "rationale": "Baseline reduces follow-up work by giving templates and exact preparation tasks.",
          "evidenceRefs": [
            "case:jobint-st-001:turn:1:baseline:cleanFinalOutput"
          ],
          "uncertainty": []
        },
        {
          "dimensionId": "communicationFit",
          "dimensionState": "diagnostic_only",
          "baselineScore": 4,
          "challengerScore": 4,
          "pairwiseWinner": "tie",
          "rationale": "Both are readable for an anxious early-career candidate.",
          "evidenceRefs": [
            "case:jobint-st-001:turn:1:baseline:cleanFinalOutput",
            "case:jobint-st-001:turn:1:challenger:cleanFinalOutput"
          ],
          "uncertainty": []
        }
      ],
      "sideScores": {
        "baseline": 4.6,
        "challenger": 4
      },
      "pairwiseWinner": "baseline",
      "winnerConfidence": "medium",
      "redLineCaps": [],
      "failureTypes": [
        "lower_executable_depth_challenger"
      ],
      "evidenceRefs": [
        "case:jobint-st-001:turn:1:baseline:cleanFinalOutput",
        "case:jobint-st-001:turn:1:challenger:cleanFinalOutput"
      ],
      "inferenceChain": [
        {
          "kind": "observed",
          "claim": "Baseline provides a 3-day plan, ability map, and conversion of prior operations experience into product-operations evidence.",
          "evidenceRefs": [
            "case:jobint-st-001:turn:1:baseline:cleanFinalOutput"
          ]
        },
        {
          "kind": "observed",
          "claim": "Challenger provides a coherent but more generic 4-ability plan.",
          "evidenceRefs": [
            "case:jobint-st-001:turn:1:challenger:cleanFinalOutput"
          ]
        },
        {
          "kind": "normative",
          "claim": "The case requires short-horizon, role-specific preparation rather than generic interview advice."
        }
      ],
      "uncertainty": []
    },
    {
      "caseId": "jobint-st-002",
      "caseType": "single_turn",
      "caseImportance": "high",
      "gradeReadiness": "ready",
      "dimensionJudgments": [
        {
          "dimensionId": "problemFramingIntent",
          "dimensionState": "scored",
          "baselineScore": 4,
          "challengerScore": 4,
          "pairwiseWinner": "tie",
          "rationale": "Both understand the three-option decision and the stability/growth tension.",
          "evidenceRefs": [
            "case:jobint-st-002:turn:1:baseline:cleanFinalOutput",
            "case:jobint-st-002:turn:1:challenger:cleanFinalOutput"
          ],
          "uncertainty": []
        },
        {
          "dimensionId": "outcomeUtility",
          "dimensionState": "scored",
          "baselineScore": 4.2,
          "challengerScore": 3.8,
          "pairwiseWinner": "baseline",
          "rationale": "Baseline gives concrete preparation allocation and role-specific narratives; challenger gives a cleaner investment-style framing but less execution detail.",
          "evidenceRefs": [
            "case:jobint-st-002:turn:1:baseline:cleanFinalOutput",
            "case:jobint-st-002:turn:1:challenger:cleanFinalOutput"
          ],
          "uncertainty": []
        },
        {
          "dimensionId": "groundingTrustCalibration",
          "dimensionState": "scored",
          "baselineScore": 3.2,
          "challengerScore": 3.7,
          "pairwiseWinner": "challenger",
          "rationale": "Baseline overstates stability and long-term career payoff for large-company paths without support; challenger is more caveated about tradeoffs.",
          "evidenceRefs": [
            "case:jobint-st-002:turn:1:baseline:cleanFinalOutput",
            "case:jobint-st-002:turn:1:challenger:cleanFinalOutput"
          ],
          "uncertainty": []
        },
        {
          "dimensionId": "riskBoundaryHandling",
          "dimensionState": "scored",
          "baselineScore": 3.5,
          "challengerScore": 4,
          "pairwiseWinner": "challenger",
          "rationale": "Challenger better frames uncertainty and tradeoffs; baseline pushes a firm ranking with weak evidence.",
          "evidenceRefs": [
            "case:jobint-st-002:turn:1:challenger:cleanFinalOutput"
          ],
          "uncertainty": []
        },
        {
          "dimensionId": "trajectoryUserEffort",
          "dimensionState": "scored",
          "baselineScore": 4.2,
          "challengerScore": 3.6,
          "pairwiseWinner": "baseline",
          "rationale": "Baseline gives a work allocation ratio and interview sequence; challenger requires more user synthesis.",
          "evidenceRefs": [
            "case:jobint-st-002:turn:1:baseline:cleanFinalOutput"
          ],
          "uncertainty": []
        }
      ],
      "sideScores": {
        "baseline": 4,
        "challenger": 3.8
      },
      "pairwiseWinner": "baseline",
      "winnerConfidence": "low",
      "redLineCaps": [],
      "failureTypes": [
        "unsupported_career_certainty_baseline",
        "lower_execution_detail_challenger"
      ],
      "evidenceRefs": [
        "case:jobint-st-002:turn:1:baseline:cleanFinalOutput",
        "case:jobint-st-002:turn:1:challenger:cleanFinalOutput"
      ],
      "inferenceChain": [
        {
          "kind": "observed",
          "claim": "Baseline ranks the roles and assigns preparation ratios.",
          "evidenceRefs": [
            "case:jobint-st-002:turn:1:baseline:cleanFinalOutput"
          ]
        },
        {
          "kind": "observed",
          "claim": "Challenger uses a risk/return analogy and asks the user to validate assumptions.",
          "evidenceRefs": [
            "case:jobint-st-002:turn:1:challenger:cleanFinalOutput"
          ]
        },
        {
          "kind": "inferred",
          "claim": "Baseline is marginally more useful for immediate preparation, but the verdict is close because of unsupported stability claims."
        }
      ],
      "uncertainty": [
        "Close call: target preference for stable vs growth-heavy career path is not externally confirmed."
      ]
    },
    {
      "caseId": "jobint-st-003",
      "caseType": "single_turn",
      "caseImportance": "high",
      "gradeReadiness": "ready",
      "dimensionJudgments": [
        {
          "dimensionId": "problemFramingIntent",
          "dimensionState": "scored",
          "baselineScore": 3.5,
          "challengerScore": 3.5,
          "pairwiseWinner": "tie",
          "rationale": "Both identify the need to reframe an unadopted consulting project for a strategy role.",
          "evidenceRefs": [
            "case:jobint-st-003:turn:1:baseline:cleanFinalOutput",
            "case:jobint-st-003:turn:1:challenger:cleanFinalOutput"
          ],
          "uncertainty": []
        },
        {
          "dimensionId": "outcomeUtility",
          "dimensionState": "scored",
          "baselineScore": 3.8,
          "challengerScore": 3.4,
          "pairwiseWinner": "baseline",
          "rationale": "Baseline supplies highly usable scripts, but much of the script invents facts not given by the user.",
          "evidenceRefs": [
            "case:jobint-st-003:turn:1:baseline:cleanFinalOutput"
          ],
          "uncertainty": []
        },
        {
          "dimensionId": "groundingTrustCalibration",